[
  {
    "name": "Moscow",
    "local_names": {
      "is": "Moskva",
      "iu": "ᒨᔅᑯ",
      "ps": "مسکو",
      "br": "Moskov",
      "el": "Μόσχα",
      "la": "Moscua",
      "mg": "Moskva",
      "tt": "Мәскәү",
      "th": "มอสโก",
      "ca": "Moscou",
      "lt": "Maskva",
      "sk": "Moskva",
      "et": "Moskva",
      "ss": "Moscow",
      "de": "Moskau",
      "za": "Moscow",
      "ascii": "Moscow",
      "ka": "მოსკოვი",
      "io": "Moskva",
      "my": "မော်စကိုမြို့",
      "da": "Moskva",
      "se": "Moskva",
      "nb": "Moskva",
      "mk": "Москва",
      "dz": "མོསི་ཀོ",
      "zh": "莫斯科",
      "ur": "ماسکو",
      "sw": "Moscow",
      "ty": "Moscou",
      "vi": "Mát-xcơ-va",
      "es": "Moscú",
      "av": "Москва",
      "ar": "موسكو",
      "kk": "Мәскеу",
      "sv": "Moskva",
      "dv": "މޮސްކޯ",
      "feature_name": "Moscow",
      "st": "Moscow",
      "af": "Moskou",
      "he": "מוסקווה",
      "ia": "Moscova",
      "tr": "Moskova",
      "uk": "Москва",
      "li": "Moskou",
      "tk": "Moskwa",
      "yi": "מאסקווע",
      "ht": "Moskou",
      "bn": "মস্কো",
      "sg": "Moscow",
      "yo": "Mọsko",
      "so": "Moskow",
      "ml": "മോസ്കോ",
      "ak": "Moscow",
      "fi": "Moskova",
      "kw": "Moskva",
      "oc": "Moscòu",
      "gl": "Moscova - Москва",
      "lv": "Maskava",
      "ab": "Москва",
      "en": "Moscow",
      "na": "Moscow",
      "ky": "Москва",
      "ln": "Moskú",
      "ie": "Moskwa",
      "bg": "Москва",
      "co": "Moscù",
      "az": "Moskva",
      "sr": "Москва",
      "cy": "Moscfa",
      "hu": "Moszkva",
      "ch": "Moscow",
      "ms": "Moscow",
      "bi": "Moskow",
      "kn": "ಮಾಸ್ಕೋ",
      "gv": "Moscow",
      "ru": "Москва",
      "ja": "モスクワ",
      "fo": "Moskva",
      "mi": "Mohikau",
      "ko": "모스크바",
      "ku": "Moskow",
      "ug": "Moskwa",
      "wo": "Mosku",
      "pl": "Moskwa",
      "zu": "IMoskwa",
      "id": "Moskwa",
      "tg": "Маскав",
      "ta": "மாஸ்கோ",
      "eo": "Moskvo",
      "pt": "Moscou",
      "ce": "Москох",
      "sl": "Moskva",
      "sh": "Moskva",
      "fy": "Moskou",
      "am": "ሞስኮ",
      "te": "మాస్కో",
      "sm": "Moscow",
      "kv": "Мӧскуа",
      "no": "Moskva",
      "wa": "Moscou",
      "kl": "Moskva",
      "qu": "Moskwa",
      "gn": "Mosku",
      "bs": "Moskva",
      "it": "Mosca",
      "bo": "མོ་སི་ཁོ།",
      "nl": "Moskou",
      "lg": "Moosko",
      "mr": "मॉस्को",
      "jv": "Moskwa",
      "ba": "Мәскәү",
      "an": "Moscú",
      "uz": "Moskva",
      "fr": "Moscou",
      "sq": "Moska",
      "fa": "مسکو",
      "ay": "Mosku",
      "hi": "मास्को",
      "mn": "Москва",
      "hr": "Moskva",
      "eu": "Mosku",
      "nn": "Moskva",
      "ro": "Moscova",
      "ga": "Moscó",
      "cu": "Москъва",
      "cs": "Moskva",
      "os": "Мæскуы",
      "cv": "Мускав",
      "hy": "Մոսկվա",
      "be": "Масква",
      "su": "Moskwa",
      "mt": "Moska",
      "sc": "Mosca",
      "vo": "Moskva",
      "kg": "Moskva",
      "tl": "Moscow",
      "gd": "Moscobha"
    },
    "lat": 55.7504461,
    "lon": 37.6174943,
    "country": "RU",
    "state": "Moscow"
  }
]